{"schema_version":"0.1","profession_id":"technical-artist","evidence_status":"TEST","evaluated_at":"2026-09-12","tested_scope":"Bounded technical-art pipeline evidence for exact asset publication, source/artifact provenance, near/far geometry and LOD structure, material/image validation, staging/no-overwrite behavior, fresh-import inspection, and explicit refusal to infer target-game readiness, collision/navigation, FPS, or visual equivalence from structural success.","package_status_at_evaluation":"EXPERIMENTAL","promotion_decision":"PROMOTE","source_evidence":[{"id":"universal-rts-foundry-46","source":"https://github.com/mike-axiom-mir/axm-universal-creation/pull/46","exact_identity":"merged Universal Creation PR #46; head 3ee62ec29733076443fb5a931092d94fa9055527; merge commit 71112cc5b249e4f48ab28a4d4651f037d962a330; tested/pushed tree 080ce8ac4a467356347bd5da97a75a823b545367","evidence_labels":["TESTED","MEASURED","VISUALLY_INSPECTED","NOT_TESTED"],"summary":"The authored RTS foundry generated near/far GLBs, named rigid components, bounded clips, collision proxies and sockets. Independent decoding validated geometry/animation/collision data while retaining that browser/target-RTS execution and performance remained unverified."},{"id":"universal-workshop-polish-47","source":"https://github.com/mike-axiom-mir/axm-universal-creation/pull/47","exact_identity":"merged Universal Creation PR #47; head 2d9128ecb0eb08a21ea9e8f283fe4fb613d2983a; merge commit fb1f645cffcac1e05f07462b20316b51d270492b; source/artifact hashes matched pushed tree 54bb1fec77c0315f00b4751181ba09bf9a8f0e1a","evidence_labels":["TESTED","MEASURED","VISUALLY_INSPECTED","NOT_TESTED"],"summary":"The focused workshop path published only after exact artifact-hash checks, used material-batched embedded-PBR near/far GLBs, independently inspected accessors/UVs/normals/images/bounds and lower-detail triangle reduction, and fresh-import rendered the actual GLB. It explicitly withheld target-RTS import, FPS and automatic perceptual acceptance."}],"fixture_results":[{"fixture_id":"techart-evidence-chain","category":"success","result":"PASS","source_evidence_ids":["universal-rts-foundry-46","universal-workshop-polish-47"],"observation":"The two source lanes bind exact source references to emitted GLBs and validation outputs. PR #46 independently decoded emitted geometry/animation/collision data; PR #47 published only after artifact hashes matched and independently checked GLB accessors, UVs, normals, embedded images, material batches, bounds and lower-detail reduction. Existing destinations were refused rather than overwritten.","non_claims":["This success is limited to the stated offline creation/validation pipeline and does not certify every DCC, renderer, engine, platform, asset family or performance target."]},{"fixture_id":"techart-import-not-game-ready","category":"boundary","result":"PASS","source_evidence_ids":["universal-rts-foundry-46","universal-workshop-polish-47"],"observation":"PR #46 states that a GLB that parses does not prove game integration and keeps the game responsible for LOD distance, hit detection, pathfinding and terrain alignment. PR #47 adds actual fresh GLB re-import renders and lower-detail geometry checks while target-RTS import, measured FPS, automatic perceptual acceptance and exact concept match remain unclaimed. The focused polish also requires collision/placement to be recalculated for its new footprint rather than silently inheriting old evidence.","non_claims":["No target-engine import acceptance, collider/nav correctness, gameplay readability, measured target-device FPS, or visual-equivalence certification for the reduced-detail model is claimed."]}],"executor_conditions":["AXM Universal Creation offline/local asset pipelines using exact Git/source identities, deterministic or independently decoded GLB evidence, explicit staging/no-overwrite publication, and Blender 4.3 fresh-import review where stated."],"non_claims":["Not a complete reconstruction of Technical Art.","Not collision, navigation, target-engine, target-device or gameplay certification.","Not proof that triangle/material reduction preserves every perceptual or gameplay-critical feature.","No 3D Art, Art Direction, Graphics Engineering, release, gameplay or institutional acceptance authority is granted by this scoped TEST."],"remaining_unknowns":["Role-only versus Professional-Body controlled baseline has not yet been run.","A second intelligence executing the same Technical Artist body has not yet been compared.","Target-RTS import, collider/navigation generation for the polished footprint, target-device profiling and LOD visual-equivalence testing remain untested.","Broader DCC/renderer/runtime interoperability beyond the exercised local paths remains untested."],"roots":{"Truth":"PASS","Agency / non-domination":"PASS","Continuity":"PASS","Wisdom before speed":"PASS"},"rollback_or_repair":"If exact source identity, pipeline facts, boundary interpretation, or fixture mapping is disproven or shown too broad, explicitly downgrade/remove this scoped TEST record while preserving the experimental body and evidence history."}