{"schema_version":"0.1","profession_id":"3d-artist","evidence_status":"TEST","evaluated_at":"2026-09-12","tested_scope":"Bounded authored 3D asset production for real near/far GLB geometry, source/editable continuity, exported-mesh render inspection, reference-led visual repair, and explicit refusal to convert successful export or polished renders into target-game integration or universal visual-quality claims.","package_status_at_evaluation":"EXPERIMENTAL","promotion_decision":"PROMOTE","source_evidence":[{"id":"universal-rts-foundry-46","source":"https://github.com/mike-axiom-mir/axm-universal-creation/pull/46","exact_identity":"merged Universal Creation PR #46; head 3ee62ec29733076443fb5a931092d94fa9055527; merge commit 71112cc5b249e4f48ab28a4d4651f037d962a330; tested/pushed tree 080ce8ac4a467356347bd5da97a75a823b545367","evidence_labels":["TESTED","MEASURED","VISUALLY_INSPECTED","NOT_TESTED"],"summary":"The authored 83-design RTS foundry emitted real near/far GLBs and independently software-rendered exported meshes across eight families. It retained that target-RTS execution, measured GPU performance and exact visual-reference fidelity were unverified and described the models as first-edition interpretations rather than completed visual matches."},{"id":"universal-workshop-polish-47","source":"https://github.com/mike-axiom-mir/axm-universal-creation/pull/47","exact_identity":"merged Universal Creation PR #47; head 2d9128ecb0eb08a21ea9e8f283fe4fb613d2983a; merge commit fb1f645cffcac1e05f07462b20316b51d270492b; source/artifact hashes matched pushed tree 54bb1fec77c0315f00b4751181ba09bf9a8f0e1a","evidence_labels":["TESTED","MEASURED","VISUALLY_INSPECTED","NOT_TESTED"],"summary":"A focused workshop polish corrected previously inadequate visual fidelity using authored Blender geometry/material operations. Final evidence used actual fresh GLB re-import renders from three views plus independent geometry/UV/normal/image/bounds checks while withholding target-RTS import, FPS, automatic perceptual acceptance and exact concept-match claims."}],"fixture_results":[{"fixture_id":"3d-real-artifact-reimport","category":"success","result":"PASS","source_evidence_ids":["universal-rts-foundry-46","universal-workshop-polish-47"],"observation":"Both sources produced real authored GLB geometry with exact source/artifact identity and independent inspection. PR #46 software-rendered exported meshes across eight families; PR #47 reopened the actual GLB in Blender and inspected three final views after geometry/material corrections. Neither source substituted a painted preview for the exported model.","non_claims":["No target-RTS import, collision/navigation acceptance, measured target-device performance, animation-system acceptance, or universal game-ready claim follows from the successful 3D artifact evidence."]},{"fixture_id":"3d-reference-fidelity-boundary","category":"boundary","result":"PASS","source_evidence_ids":["universal-rts-foundry-46","universal-workshop-polish-47"],"observation":"PR #46 retained that its 83 exported models were stylized first editions that did not equal the references' detail/finish. PR #47 explicitly began because that technically valid pack had inadequate visual fidelity, then repaired one workshop through iterative visual review without claiming the other 82 designs were upgraded. Technical export validity therefore did not silently become visual-quality acceptance.","non_claims":["This does not establish a universal aesthetic score, human preference, complete art-direction competence, or proof that every asset family now meets the supplied visual references."]}],"executor_conditions":["AXM Universal Creation authored/local 3D workflows using exact Git/source identities, deterministic GLB export/inspection, optional offline Blender review where stated, and explicit reference-led visual inspection without treating a preview as the underlying asset."],"non_claims":["Not a complete reconstruction of 3D Art.","Not target-engine/game integration, collider, navigation or performance certification.","Not proof that all 83 RTS designs received the focused workshop polish.","No Technical Art, Art Direction, Graphics Engineering, gameplay, product or institutional acceptance authority is granted by this scoped TEST."],"remaining_unknowns":["Role-only versus Professional-Body controlled baseline has not yet been run.","A second intelligence executing the same 3D Artist body has not yet been compared.","Target-RTS import, gameplay-scale readability, collider/navigation behavior, broader lighting conditions and target-device performance remain untested.","The focused reference-led polish has not yet been repeated across multiple unrelated asset families under this body."],"roots":{"Truth":"PASS","Agency / non-domination":"PASS","Continuity":"PASS","Wisdom before speed":"PASS"},"rollback_or_repair":"If exact source identity, exported-asset facts, visual-review interpretation, or scope mapping is disproven or shown too broad, explicitly downgrade/remove this scoped TEST record while preserving the experimental body and evidence history."}